### ISSUE TITLE
Reverse Tunnel Stops Accepting New Connections After Some Time

### ISSUE THREAD

**Issue by andrewfer000** [erebe/wstunnel#534]
## Describe the bug
I have an application server running on a server that uses wstunnel to create a public access point for testing. I noticed it works very well for around the first 20 minutes and it then stops working. However clients who already established a connection to the application stay connected. It just rejects new connections. 

## To Reproduce
1. On your local Debian 13 VM, setup a reverse tunnel to your public server (Debian 13) to allow access to a local application
2. Wait around 20 minutes. See that new connections are no longer working. No errors in the log on either the machine running the application server (wstunnel client) or the wstunnel server. It just stops working. Users who are actively using the application are unaffected. The log also stops as if the connection  was cut between the wstunnel client and server.

## Expected behavior
1. The wstunnel client does not stop accepting new user connections from the public endpoint. 

## Your wstunnel setup
Paste your logs of wstunnel, started with `--log-lvl=DEBUG`, and with the `command line used`
 - client 
./wstunnel client -R 'tcp://[::1]:1234:localhost:1234' --tls-sni-override=reverseinbound wss://12.34.56.78 --http-upgrade-path-prefix 'password' --http-headers 'Host: reverseinbound' --websocket-ping-frequency 30s

- server
./wstunnel server wss://[::]:8448 --restrict-http-upgrade-path-prefix 'password'

## Desktop (please complete the following information):
 - OS: Debian
 - Version 13

**Comment by theOvercloud** [comment]
I have a very similar issue on my end. The connection somehow goes stale and i can no longer use the reverse proxies. What i found interesting is that i can not capture any pings from the client in tcpdump. I see packages coming in initially, but then there is no more traffic between the client and the server. So, i do not see the keep alive packages (configured to be 15s in my case).

Here is the tcp dump when stopping and then starting the client while the server is running. I see no more output after that point.

```
2026-08-25 13:41:10.685134 IP 10.5.0.1.47614 > 10.5.2.17.443: Flags [P.], seq 3997585058:3997585082, ack 2457456430, win 689, options [nop,nop,TS val 2095477011 ecr 1305197773], length 24
2026-08-25 13:41:10.685196 IP 10.5.2.17.443 > 10.5.0.1.47614: Flags [.], ack 24, win 636, options [nop,nop,TS val 1306484896 ecr 2095477011], length 0
2026-08-25 13:41:10.686336 IP 10.5.0.1.47614 > 10.5.2.17.443: Flags [F.], seq 24, ack 1, win 689, options [nop,nop,TS val 2095477011 ecr 1305197773], length 0
2026-08-25 13:41:10.686565 IP 10.5.2.17.443 > 10.5.0.1.47614: Flags [R.], seq 1, ack 25, win 636, options [nop,nop,TS val 1306484897 ecr 2095477011], length 0
2026-08-25 13:41:14.403294 IP 10.5.0.1.46350 > 10.5.2.17.443: Flags [S], seq 2805001096, win 65280, options [mss 1280,sackOK,TS val 2095480728 ecr 0,nop,wscale 7], length 0
2026-08-25 13:41:14.403370 IP 10.5.2.17.443 > 10.5.0.1.46350: Flags [S.], seq 1361088110, ack 2805001097, win 65160, options [mss 1460,sackOK,TS val 2825089223 ecr 2095480728,nop,wscale 7], length 0
2026-08-25 13:41:14.419493 IP 10.5.0.1.46350 > 10.5.2.17.443: Flags [.], ack 1, win 510, options [nop,nop,TS val 2095480745 ecr 2825089223], length 0
2026-08-25 13:41:14.435697 IP 10.5.0.1.46350 > 10.5.2.17.443: Flags [P.], seq 1:2537, ack 1, win 510, options [nop,nop,TS val 2095480760 ecr 2825089223], length 2536
2026-08-25 13:41:14.435697 IP 10.5.0.1.46350 > 10.5.2.17.443: Flags [P.], seq 2537:2916, ack 1, win 510, options [nop,nop,TS val 2095480760 ecr 2825089223], length 379
2026-08-25 13:41:14.435738 IP 10.5.2.17.443 > 10.5.0.1.46350: Flags [.], ack 2537, win 549, options [nop,nop,TS val 2825089255 ecr 2095480760], length 0
2026-08-25 13:41:14.435761 IP 10.5.2.17.443 > 10.5.0.1.46350: Flags [.], ack 2916, win 569, options [nop,nop,TS val 2825089255 ecr 2095480760], length 0
2026-08-25 13:41:14.436472 IP 10.5.2.17.443 > 10.5.0.1.46350: Flags [P.], seq 1:1330, ack 2916, win 569, options [nop,nop,TS val 2825089256 ecr 2095480760], length 1329
2026-08-25 13:41:14.449127 IP 10.5.0.1.46350 > 10.5.2.17.443: Flags [.], ack 1, win 510, options [nop,nop,TS val 2095480776 ecr 2825089255,nop,nop,sack 1 {1269:1330}], length 0
2026-08-25 13:41:14.451277 IP 10.5.0.1.46350 > 10.5.2.17.443: Flags [.], ack 1330, win 530, options [nop,nop,TS val 2095480776 ecr 2825089256], length 0
2026-08-25 13:41:14.468503 IP 10.5.0.1.46350 > 10.5.2.17.443: Flags [P.], seq 2916:3537, ack 1330, win 530, options [nop,nop,TS val 2095480793 ecr 2825089256], length 621
2026-08-25 13:41:14.468724 IP 10.5.2.17.443 > 10.5.0.1.46350: Flags [P.], seq 1330:2705, ack 3537, win 588, options [nop,nop,TS val 2825089288 ecr 2095480793], length 1375
2026-08-25 13:41:14.482456 IP 10.5.0.1.46350 > 10.5.2.17.443: Flags [.], ack 1330, win 550, options [nop,nop,TS val 2095480809 ecr 2825089256,nop,nop,sack 1 {2598:2705}], length 0
2026-08-25 13:41:14.482477 IP 10.5.0.1.46350 > 10.5.2.17.443: Flags [.], ack 2705, win 570, options [nop,nop,TS val 2095480809 ecr 2825089288], length 0
```

Could there be an issue with the keep-alive?

Relevant server logs:
```
...
wstunnel-server-1  | 2026-08-25T11:44:57.210603Z  INFO cnx{peer="172.19.0.5:40106"}: wstunnel::tunnel::server::server: Accepting connection
wstunnel-server-1  | 2026-08-25T11:44:57.210708Z  INFO cnx{peer="172.19.0.5:40106"}:tunnel: wstunnel::tunnel::server::server: Request X-Forwarded-For: 127.0.0.1
wstunnel-server-1  | 2026-08-25T11:44:57.210749Z  INFO cnx{peer="172.19.0.5:40106"}:tunnel{forwarded_for="127.0.0.1" id="01a038bc-df64-7341-b835-593b52666329" remote="[::]:0"}: wstunnel::tunnel::server::server: Tunnel accepted due to matched restriction: Allow SSH reverse tunnel via unix socket
```

Client logs:
```
2026-08-25T11:41:14.394917Z  INFO wstunnel: Starting wstunnel client v10.6.1
2026-08-25T11:41:14.394958Z  INFO wstunnel: Connecting to unix socket LocalToRemote { local_protocol: ReverseUnix { path: "/run/wstunnel/xyz.sock" }, local: [::]:0, remote: (Ipv4(127.0.0.1), 22) }
2026-08-25T11:41:14.395094Z  INFO wstunnel::protocols::tcp::server: Opening TCP connection to 127.0.0.1:8443
2026-08-25T11:41:14.395176Z DEBUG wstunnel::protocols::tcp::server: Connecting to 127.0.0.1:8443
2026-08-25T11:41:14.395382Z DEBUG wstunnel::protocols::tcp::server: Connected to tcp endpoint 127.0.0.1:8443, aborted all other connection attempts
2026-08-25T11:41:14.395535Z DEBUG tunnel{id="01a038b9-791b-7911-a77d-4223d2f64b00" remote="[::]:0"}: wstunnel::tunnel::transport::websocket: with HTTP upgrade request Request { method: GET, uri: /wstunnel/events, version: HTTP/1.1, headers: {"host": "127.0.0.1:8443", "upgrade": "websocket", "connection": "upgrade", "sec-websocket-key": "...", "sec-websocket-version": "13", "sec-websocket-protocol": "..."}, body: Empty }
^C
root@poleno-10001:~# RUST_LOG=debug /usr/bin/wstunnel client  --websocket-ping-frequency 15s     -R unix:///run/wstunnel/poleno-10001_ssh.sock:127.0.0.1:22     --http-upgrade-path-prefix wstunnel  ws://127.0.0.1:8443
2026-08-25T11:44:57.188811Z  INFO wstunnel: Starting wstunnel client v10.6.1
2026-08-25T11:44:57.188857Z  INFO wstunnel: Connecting to unix socket LocalToRemote { local_protocol: ReverseUnix { path: "/run/wstunnel/xyz.sock" }, local: [::]:0, remote: (Ipv4(127.0.0.1), 22) }
2026-08-25T11:44:57.188998Z  INFO wstunnel::protocols::tcp::server: Opening TCP connection to 127.0.0.1:8443
2026-08-25T11:44:57.189079Z DEBUG wstunnel::protocols::tcp::server: Connecting to 127.0.0.1:8443
2026-08-25T11:44:57.189275Z DEBUG wstunnel::protocols::tcp::server: Connected to tcp endpoint 127.0.0.1:8443, aborted all other connection attempts
2026-08-25T11:44:57.189413Z DEBUG tunnel{id="01a038bc-df64-7341-b835-593b52666329" remote="[::]:0"}: wstunnel::tunnel::transport::websocket: with HTTP upgrade request Request { method: GET, uri: /wstunnel/events, version: HTTP/1.1, headers: {"host": "127.0.0.1:8443", "upgrade": "websocket", "connection": "upgrade", "sec-websocket-key": "...", "sec-websocket-version": "13", "sec-websocket-protocol": "..."}, body: Empty }
```

When i now wait for some time and try to ssh using the socket file, I see some output on the server but nothing new on the client:

```
9" remote="[::]:0"}: wstunnel::tunnel::server::server: Tunnel accepted due to matched restriction: Allow SSH reverse tunnel via unix socket
wstunnel-server-1  | 2026-08-25T11:49:52.073029Z  INFO cnx{peer="172.19.0.5:40106"}:tunnel{forwarded_for="127.0.0.1" id="01a038bc-df64-7341-b835-593b52666329" remote="[::]:0"}: wstunnel::tunnel::server::server: connected to ReverseUnix { path: "/run/wstunnel/xyz.sock" } [::7a9d:ebb3:8262:8f1f]:0
wstunnel-server-1  | 2026-08-25T11:49:58.700487Z  INFO cnx{peer="172.19.0.5:40106"}:tunnel{forwarded_for="127.0.0.1" id="01a038bc-df64-7341-b835-593b52666329" remote="[::]:0"}: wstunnel::tunnel::transport::io: Closing local => remote tunnel
wstunnel-server-1  | 2026-08-25T11:49:58.700563Z  INFO cnx{peer="172.19.0.5:40106"}:tunnel{forwarded_for="127.0.0.1" id="01a038bc-df64-7341-b835-593b52666329" remote="[::]:0"}: wstunnel::tunnel::transport::io: Closing local <= remote tunnel
```

**Comment by erebe** [comment]
Hello,
Thanks for reporting, would you mind trying out the latest release ? 
https://github.com/erebe/wstunnel/releases/tag/v10.7.1

I have added some logs in case the reverse tunnel listener stopped. It should helps me investigate further the issue.

**Comment by erebe** [comment]
It should be fixed in  https://github.com/erebe/wstunnel/releases/tag/v11.0.0 
Let me know ;)
